{
  "$schema": "../schemas/count-rules.schema.json",
  "schema": "reconstruct-gkg/count-rules/v1",
  "name": "gdelt-count-candidates-v2-counts",
  "settings": {
    "object_nouns": [
      "people",
      "person",
      "persons",
      "men",
      "man",
      "women",
      "woman",
      "children",
      "child",
      "civilians",
      "civilian",
      "soldiers",
      "soldier",
      "officers",
      "officer",
      "police",
      "policemen",
      "policeman",
      "protesters",
      "protester",
      "demonstrators",
      "demonstrator",
      "suspects",
      "suspect",
      "militants",
      "militant",
      "rebels",
      "rebel",
      "fighters",
      "fighter",
      "hostages",
      "hostage",
      "passengers",
      "passenger",
      "workers",
      "worker",
      "students",
      "student",
      "patients",
      "patient",
      "residents",
      "resident",
      "villagers",
      "villager",
      "migrants",
      "migrant",
      "refugees",
      "refugee",
      "inmates",
      "inmate",
      "prisoners",
      "prisoner",
      "jihadists",
      "jihadist",
      "missionaries",
      "missionary",
      "tourists",
      "tourist",
      "journalists",
      "journalist",
      "reporters",
      "reporter",
      "attackers",
      "attacker",
      "adults",
      "adult",
      "babies",
      "baby"
    ],
    "auxiliaries": [
      "were",
      "was",
      "are",
      "is",
      "have been",
      "has been",
      "had been"
    ],
    "unsafe_phrases": [
      "no",
      "not",
      "never",
      "neither",
      "without",
      "could",
      "would",
      "may",
      "might",
      "will",
      "should",
      "if",
      "denied",
      "denies",
      "deny",
      "between"
    ],
    "unsafe_suffixes": [
      "n't"
    ],
    "bad_object_words": [
      "and",
      "or",
      "not",
      "no",
      "other",
      "more",
      "fewer",
      "remaining",
      "another"
    ],
    "max_object_modifiers": 3,
    "context_words": 10,
    "allow_bare_active": true
  },
  "rules": [
    {
      "id": "active_predicate-8190a7f6a9930d74",
      "kind": "active_predicate",
      "expression": "abducted",
      "labels": [
        "KIDNAP"
      ],
      "status": "enabled",
      "provenance": {
        "evidence": [
          {
            "label": "KIDNAP",
            "source": "count_seeds.json",
            "evidence_status": "experimental_authored_rule"
          }
        ]
      }
    },
    {
      "id": "active_predicate-a7a74dfa8f503e23",
      "kind": "active_predicate",
      "expression": "affected",
      "labels": [
        "AFFECT",
        "CRISISLEX_CRISISLEXREC"
      ],
      "status": "enabled",
      "provenance": {
        "evidence": [
          {
            "label": "AFFECT",
            "source": "count_seeds.json",
            "evidence_status": "experimental_authored_rule"
          }
        ]
      }
    },
    {
      "id": "active_predicate-9041911f272e24aa",
      "kind": "active_predicate",
      "expression": "arrested",
      "labels": [
        "ARREST",
        "CRISISLEX_C07_SAFETY"
      ],
      "status": "enabled",
      "provenance": {
        "evidence": [
          {
            "label": "ARREST",
            "source": "count_seeds.json",
            "evidence_status": "experimental_authored_rule"
          },
          {
            "label": "CRISISLEX_C07_SAFETY",
            "source": "count_seeds.json",
            "evidence_status": "experimental_authored_rule"
          }
        ]
      }
    },
    {
      "id": "active_predicate-baabe7de7c4d7ac7",
      "kind": "active_predicate",
      "expression": "assassinated",
      "labels": [
        "ASSASSINATION"
      ],
      "status": "enabled",
      "provenance": {
        "evidence": [
          {
            "label": "ASSASSINATION",
            "source": "count_seeds.json",
            "evidence_status": "experimental_authored_rule"
          }
        ]
      }
    },
    {
      "id": "active_predicate-83a21eec526f6df4",
      "kind": "active_predicate",
      "expression": "charged",
      "labels": [
        "ARREST",
        "CRISISLEX_C07_SAFETY",
        "SOC_GENERALCRIME"
      ],
      "status": "enabled",
      "provenance": {
        "evidence": [
          {
            "label": "ARREST",
            "source": "count_seeds.json",
            "evidence_status": "experimental_authored_rule"
          },
          {
            "label": "CRISISLEX_C07_SAFETY",
            "source": "count_seeds.json",
            "evidence_status": "experimental_authored_rule"
          },
          {
            "label": "SOC_GENERALCRIME",
            "source": "count_seeds.json",
            "evidence_status": "experimental_authored_rule"
          }
        ]
      }
    },
    {
      "id": "active_predicate-16409c50f6a6780f",
      "kind": "active_predicate",
      "expression": "confiscated",
      "labels": [
        "SEIZE"
      ],
      "status": "enabled",
      "provenance": {
        "evidence": [
          {
            "label": "SEIZE",
            "source": "count_seeds.json",
            "evidence_status": "experimental_authored_rule"
          }
        ]
      }
    },
    {
      "id": "active_predicate-40be2b767ae546bc",
      "kind": "active_predicate",
      "expression": "convicted",
      "labels": [
        "SOC_GENERALCRIME"
      ],
      "status": "enabled",
      "provenance": {
        "evidence": [
          {
            "label": "SOC_GENERALCRIME",
            "source": "count_seeds.json",
            "evidence_status": "experimental_authored_rule"
          }
        ]
      }
    },
    {
      "id": "predicate-c4636d5bc8dd5a51",
      "kind": "predicate",
      "expression": "dead",
      "labels": [
        "CRISISLEX_CRISISLEXREC",
        "CRISISLEX_T03_DEAD",
        "KILL"
      ],
      "status": "enabled",
      "provenance": {
        "evidence": [
          {
            "label": "CRISISLEX_CRISISLEXREC",
            "source": "count_seeds.json",
            "evidence_status": "experimental_authored_rule"
          },
          {
            "label": "CRISISLEX_T03_DEAD",
            "source": "count_seeds.json",
            "evidence_status": "experimental_authored_rule"
          },
          {
            "label": "KILL",
            "source": "count_seeds.json",
            "evidence_status": "experimental_authored_rule"
          }
        ]
      }
    },
    {
      "id": "predicate-3ab9f66c6417592f",
      "kind": "predicate",
      "expression": "demonstrated",
      "labels": [
        "PROTEST"
      ],
      "status": "enabled",
      "provenance": {
        "evidence": [
          {
            "label": "PROTEST",
            "source": "count_seeds.json",
            "evidence_status": "experimental_authored_rule"
          }
        ]
      }
    },
    {
      "id": "active_predicate-ebaa3aee1add5884",
      "kind": "active_predicate",
      "expression": "detained",
      "labels": [
        "ARREST",
        "CRISISLEX_C07_SAFETY"
      ],
      "status": "enabled",
      "provenance": {
        "evidence": [
          {
            "label": "ARREST",
            "source": "count_seeds.json",
            "evidence_status": "experimental_authored_rule"
          },
          {
            "label": "CRISISLEX_C07_SAFETY",
            "source": "count_seeds.json",
            "evidence_status": "experimental_authored_rule"
          }
        ]
      }
    },
    {
      "id": "predicate-cc994c01e7a453e4",
      "kind": "predicate",
      "expression": "died",
      "labels": [
        "CRISISLEX_T03_DEAD",
        "KILL"
      ],
      "status": "enabled",
      "provenance": {
        "evidence": [
          {
            "label": "CRISISLEX_T03_DEAD",
            "source": "count_seeds.json",
            "evidence_status": "experimental_authored_rule"
          },
          {
            "label": "KILL",
            "source": "count_seeds.json",
            "evidence_status": "experimental_authored_rule"
          }
        ]
      }
    },
    {
      "id": "active_predicate-50929ba926879bb5",
      "kind": "active_predicate",
      "expression": "displaced",
      "labels": [
        "AFFECT",
        "CRISISLEX_CRISISLEXREC",
        "CRISISLEX_T09_DISPLACEDRELOCATEDEVACUATED",
        "DISPLACED"
      ],
      "status": "enabled",
      "provenance": {
        "evidence": [
          {
            "label": "CRISISLEX_T09_DISPLACEDRELOCATEDEVACUATED",
            "source": "count_seeds.json",
            "evidence_status": "experimental_authored_rule"
          },
          {
            "label": "DISPLACED",
            "source": "count_seeds.json",
            "evidence_status": "experimental_authored_rule"
          }
        ]
      }
    },
    {
      "id": "predicate-c71052dc667dbbca",
      "kind": "predicate",
      "expression": "drowned",
      "labels": [
        "NATURAL_DISASTER_DROWNED"
      ],
      "status": "enabled",
      "provenance": {
        "evidence": [
          {
            "label": "NATURAL_DISASTER_DROWNED",
            "source": "count_seeds.json",
            "evidence_status": "experimental_authored_rule"
          }
        ]
      }
    },
    {
      "id": "active_predicate-fef526dcc00cac77",
      "kind": "active_predicate",
      "expression": "evacuated",
      "labels": [
        "AFFECT",
        "CRISISLEX_CRISISLEXREC",
        "CRISISLEX_T09_DISPLACEDRELOCATEDEVACUATED",
        "EVACUATION"
      ],
      "status": "enabled",
      "provenance": {
        "evidence": [
          {
            "label": "CRISISLEX_T09_DISPLACEDRELOCATEDEVACUATED",
            "source": "count_seeds.json",
            "evidence_status": "experimental_authored_rule"
          },
          {
            "label": "EVACUATION",
            "source": "count_seeds.json",
            "evidence_status": "experimental_authored_rule"
          }